ProductID,Name,Description,Quantity,TagID,CategoryID
1,Any,Often buy third Democrat.,159,9,5
2,Them,Identify place official Mr table we.,134,6,8
3,Book,White choose result first happy since seat.,116,15,10
4,Everybody,Weight level but professional.,120,19,3
5,Check,Main partner hundred sister individual blue attention.,56,2,5
6,Simple,Nor parent ago site until health.,187,15,10
7,Enter,Street mention positive cost require.,175,6,4
8,Assume,Pull front save.,103,11,8
9,Executive,Kitchen since town.,92,3,7
10,Edge,Large article bad require Congress.,98,3,2
11,Decision,Card firm through air step product personal study.,179,14,8
12,Official,Travel already national baby increase east.,156,2,3
13,Fine,Put total north finish although indeed.,60,10,6
14,Yeah,However fund great against south say land.,132,3,3
15,Line,Together anything yard teach off.,51,13,6
16,Sure,Begin employee wrong blue suffer.,110,20,6
17,Shoulder,Ground cold director.,67,4,2
18,Cultural,Play owner value something claim.,146,15,4
19,Wrong,Pressure evidence appear group.,83,9,3
20,Prove,Accept summer try among control.,14,18,7
21,Sea,Resource already child husband hour professional should American.,100,9,10
22,Growth,Leader fine meeting drive.,139,18,7
23,Group,Sing what wait hair yard enough oil.,13,17,1
24,Wonder,Though guy miss TV coach.,131,2,6
25,Lot,Five certain successful economic coach tree not statement.,156,7,7
26,Husband,Close responsibility seek research sport in.,174,1,9
27,Worry,Opportunity small high benefit whose fine.,68,12,9
28,Much,True energy find.,165,12,6
29,Member,Subject card less continue never.,172,11,8
30,Return,Cause experience agent everybody other.,143,8,2
31,Show,Professor really product again red community year million.,143,1,10
32,Total,Age hear bring be white sound off.,20,12,7
33,My,Short source commercial over wife.,190,12,7
34,Water,Show history development firm.,177,8,3
35,Similar,Data field wind identify red rock baby lot.,98,20,2
36,Can,Military far everybody whatever.,47,16,1
37,Resource,Have sell billion history later data.,104,8,7
38,Thing,State believe tax garden.,150,14,9
39,Range,To democratic degree term peace evidence up.,98,20,7
40,Eye,Include class seven culture impact anyone include.,17,14,2
41,Accept,Huge policy someone drive.,23,17,1
42,Money,Tv with hear firm over somebody.,107,10,6
43,Change,Win expect whole send action program its.,165,8,7
44,Somebody,Soon stock do suggest history fight plan century.,173,6,6
45,Person,Crime allow occur around kid explain television.,147,9,10
46,Lot,Phone her girl choose forward least system.,116,16,4
47,Mean,Deal bad rather employee practice natural truth.,9,1,1
48,Growth,Special place possible sound care around bring people.,111,19,9
49,Commercial,Beautiful analysis least like determine easy.,196,11,4
50,Record,Act see teacher tax toward.,70,2,6
51,Until,Some approach either social center another three difficult.,144,20,7
52,Heavy,Response budget send good various.,81,19,5
53,Hand,Member up three though life.,164,11,10
54,Level,Blue recent themselves short star while.,161,18,8
55,Quality,Condition material black strategy almost.,161,3,9
56,Truth,Always lose drug method industry make.,52,1,4
57,Bad,To street bring yes.,73,1,7
58,Unit,Study investment focus laugh.,194,17,5
59,High,Should attack special you after choose green.,35,4,2
60,Customer,Most believe develop direction turn knowledge project.,169,15,2
61,Seem,Own mission art artist avoid cup bag.,71,4,7
62,Hit,Court budget pretty me able establish mission window.,68,14,10
63,Player,Even sort strong town west follow enough.,127,17,6
64,Represent,Walk interview throw win off likely economic.,183,15,4
65,Base,Eye fire drive second.,12,8,5
66,Before,Those international avoid.,117,14,5
67,Food,Cut father everything church her relationship dog.,45,6,5
68,Nature,Rock measure leave pressure.,105,13,3
69,Field,He beautiful city participant another collection.,9,11,4
70,Performance,Night best lay common eye continue.,187,16,6
71,Break,Middle bad according technology different true performance.,102,7,7
72,Forward,Think cut usually bit.,62,4,4
73,Ahead,Arrive whether strategy attack education.,6,18,10
74,Alone,Stage production charge size walk.,89,8,1
75,Help,Business office watch specific get behind.,145,13,10
76,Western,Something public change bad figure south tend.,27,11,1
77,True,For wrong old friend activity especially.,17,15,2
78,Several,Among special audience modern describe begin.,198,4,8
79,Several,Whatever win take democratic light free.,172,12,8
80,Need,Style two sit reality opportunity window federal good.,126,11,10
81,Structure,Baby resource might product phone despite.,195,9,8
82,Never,Scientist thank finally myself culture.,152,15,1
83,Green,Sell court magazine early federal.,162,15,10
84,Tonight,Face reduce night strategy.,36,6,7
85,Prepare,Through other kind than skin.,101,13,6
86,Born,Couple reach manage field they.,49,11,2
87,For,Color total few girl general smile page this.,161,3,5
88,Father,Course rest benefit plan service this.,121,14,6
89,Political,International issue bring stock.,22,18,4
90,Project,Concern a between.,144,1,9
91,Physical,Direction become bill develop local.,168,2,2
92,No,Four dog interesting few skin white.,49,12,2
93,Remain,Down century case the event.,178,4,4
94,Environment,Number stock drive.,171,10,10
95,Course,Eye model mean response whom.,94,10,3
96,East,Almost scientist yes condition hope bank authority.,112,1,5
97,Whether,Someone every big must.,155,2,1
98,Floor,Indeed four Congress only increase suffer.,46,7,3
99,Several,While new radio national major.,186,1,1
100,Yet,Do on the along economic again show.,92,1,6
